id_category;id_parent;id_shop_default;level_depth;nleft;nright;active;date_add;date_upd;position;is_root_category;id_shop;id_lang;name;description;link_rewrite;meta_title;meta_keywords;meta_description;
"18";"13";"1";"3";"4";"5";"1";"2015-09-19 12:06:25";"2015-09-28 10:13:31";"0";"0";"1";"1";"Dinafem";"Este excelente banco de semillas feminizadas llamado Dinafem ofrece desde 2005 unas variedades exquisitas muy selectas, como la destacada Moby Dick, procedente de sativas ecuatoriales, Royal Haze, Power Kush, Super Silver Haze o la famosa White Whidow.";"dinafem";"Dinafem Semillas De Marihuana";"Dinafem,semillas Dinafem,semillas Dinafem de calidad,semillas Dinafem baratas";"";
"19";"13";"1";"3";"6";"7";"1";"2015-09-19 12:08:04";"2015-10-24 12:57:07";"1";"0";"1";"1";"GeaSeeds";"El objetivo de GeaSeeds es poder vender semillas de la mejor calidad al mejor precio, pasando unos exhaustivos controles de calidad, para así garantizar el máximo porcentaje de la germinación y estabilidad genética.Las semillas son de cosechas recientes, así que es imposible adquirir unas semillas más frescas que estas en el mercado.";"geaseeds";"GeaSeeds Semillas De Marihuana";"semillas de marihuana,semillas marihuana de calidad,semillas GeaSeeds,semillas GeaSeeds baratas,semillas GeaSeeds de calidad,semillas baratas";"GeaSeeds Semillas Feminizadas De Marihuana";
"20";"13";"1";"3";"8";"9";"1";"2015-09-19 12:24:08";"2015-09-28 10:05:15";"2";"0";"1";"1";"Sensi Seeds";"Sensi Seeds, solo leyendo su nombre nos provoca sensaciones mágicas, Sensi Seeds es uno de los bancos de semillas de marihuana más reconocidos y importantes del mundo.";"sensi-seeds";"Sensi Seeds Semillas De Marihuana";"Sensi Seeds,semillas de calidad Sensi Seeds,semillas baratas Sensi Seeds,semillas baratas Sensi Seeds";"";
"21";"13";"1";"3";"10";"11";"1";"2015-09-19 12:31:13";"2015-09-28 10:06:54";"3";"0";"1";"1";"Sweet Seeds";"Este famoso y excelente banco de semillas conocido como Sweet Seeds está especializado en la selección, conversación y mejora genética de las nuevas gamas de semillas feminizadas de marihuana y también autoflorecientes de altísima calidad.
Las principales variedades de Sweet Seeds destacan en sus propiedades organolépticas.
Son aromáticas y dulces, además son fáciles para el cultivo exterior y cultivo interior de cannabis.
Nuestras semillas de Sweet Seeds pasan por un riguroso proceso de selección y únicamente las mejores semillas de marihuana pasan al envasado, además de conservarse en condiciones de baja temperatura y humedad para así poder garantizar al 95% su germinación.";"sweet-seeds";"Sweet Seeds Semillas De Marihuana";"Sweet Seeds,semillas Sweet Seeds,semillas de calidad Sweet Seeds,semillas baratas Sweet Seeds,semillas baratas Sweet Seeds";"";
"22";"13";"1";"3";"12";"13";"1";"2015-09-19 12:34:21";"2015-10-15 17:47:14";"4";"0";"1";"1";"Dutch Passion";"Este banco de semillas de marihuana llamado Dutch Passion produce, desarrolla, mejora y vende semillas de marihuana desde el año 1987.
Dutch Passion és una de las principales empresas holandesas especializadas en crianza y producción de semillas de cannabis.";"dutch-passion";"Dutch Passion Semillas De Marihuana";"Dutch Passion Semillas De Marihuana,Dutch Passion,semillas Dutch Passion,semillas baratas Dutch Passion,semillas de calidad Dutch Passion";"";
"25";"13";"1";"3";"14";"15";"1";"2015-09-19 12:41:32";"2015-10-15 17:56:05";"5";"0";"1";"1";"Cannabiogen";"Este banco de semillas denominado Cannabiogen trajo de sus largos viajes unas variedades de semillas de marihuana buscadas en lugares como Colombia, montañas de Jamaica, Pakistan, India, Tailandia… Para luego estabilizarlas y mejorar su calidad y producción. ";"cannabiogen";"Cannabiogen Semillas De Marihuana";"semillas Cannabiogen,Cannabiogen,semillas baratas Cannabiogen,semillas de calidad Cannabiogen";"";
"26";"13";"1";"3";"16";"17";"1";"2015-09-19 13:02:00";"2015-09-28 10:11:46";"6";"0";"1";"1";"Advanced Seeds ";"Todas las semillas de marihuana de Advanced Seeds han sido producidas y desarolladas mediante métodos orgánicos de cultivo. 
Advanced Seeds únicamente utiliza insecticidas y fertilizantes naturales en su producción.
 Advanced Seeds emplea un sistema totalmente seguro para obtener semillas feminizadas sin ningún tipo de ingeniería genética de máxima calidad, toda la producción de semillas de marihuana feminizadas se realiza bajo unos estrictos controles en cámaras aisladas que garantizan la identidad y pureza de cada cepa.";"advanced-seeds-";"Advanced Seeds Semillas De Marihuana";"Advanced Seeds,semillas Advanced Seeds,semillas baratas Advanced Seeds,semillas de calidad Advanced Seeds";"";
"27";"13";"1";"3";"18";"19";"1";"2015-09-19 13:05:33";"2015-09-28 10:09:55";"7";"0";"1";"1";"Buddha Seeds";"Este banco de semillas de marihuana conocido como Buddha Seeds se ha esforzado en todo momento en ofrecer variedades de marihuana automáticas de altísima calidad, consiguiendo excelentes resultados en cuanto a sabor y efecto, con una producción que va de buena a muy buena, a medida que van evolucionando en su trabajo de selección y estabilización.
Cada generación cuenta, y Buddha Seeds consigue destacar en cada salto evolutivo, estando siempre presente en boca de todos como un banco marihuana automática de alta calidad.";"buddha-seeds";"Buddha Seeds";"Buddha Seeds,semillas Buddha Seeds,semillas de calidad Buddha Seeds,semillas baratas Buddha Seeds";"";
"28";"13";"1";"3";"20";"21";"1";"2015-09-19 13:06:54";"2015-09-28 10:10:24";"8";"0";"1";"1";"Barney's Farm";"Este banco de semillas de cannabis es conocido como Barney's Farm ha estado seleccionando genéticas de todo el mundo desde los años 80, y esto le ha permitido a Barney's Farm crear cruces al alcance de muy pocos bancos y así poder ofrecer a sus clientes nuevos y suculentos cruces.";"barney-s-farm";"Barney's Farm Semillas De Marihuana";"Barney's Farm,semillas Barney's Farm,semillas de calidad Barney's Farm,semillas baratas Barney's Farm";"";
"29";"13";"1";"3";"22";"23";"1";"2015-09-19 13:10:10";"2015-09-28 10:04:02";"9";"0";"1";"1";"Positronics";"Este famoso banco nombrado Positronics colaboró activamente en el nacimiento y desarroyo de los primeros híbridos de Cannabis en los años setenta. 
Se consiguió, no sin problemas, exportar nuevas variedades a Holanda donde se instalaron para poder trabajar de una forma profesional. Fueron pioneros en desarrollar la técnica del cultivo sin semilla mediante esquejes, que supuso todo una revolución para finales de los años setenta.
Positronics se consolidó en Ámsterdam como la empresa pionera en la crianza selectiva del Cannabis. Desde entonces hasta hoy, el siglo XXI, la crianza no ha dejado de extenderse entre miles de cultivadores.
";"positronics";"Positronics Semillas De Marihuana";"Positronics,Positronics semillas,Positronics semillas de calidad,semillas baratas Positronics";"";
"64";"13";"1";"3";"24";"25";"1";"2015-10-13 09:41:53";"2015-10-13 09:41:53";"10";"0";"1";"1";"Green House Seeds";"";"green-house-seeds";"Green House Seeds Semillas De Marihuana";"semillas de marihuana,semillas de marihuana baratas,semillas de calidad,semillas Green House Seeds,Green House Seeds";"";
"65";"13";"1";"3";"26";"27";"1";"2015-10-13 09:42:33";"2015-10-13 09:42:33";"11";"0";"1";"1";"Paradise Seeds";"";"paradise-seeds";"Paradise Seeds Semillas De Marihuana";"semillas de marihuana,semillas de marihuana baratas,semillas de marihuana Paradise Seeds,semillas Paradise Seeds,banco Paradise Seeds";"";
"66";"13";"1";"3";"28";"29";"1";"2015-10-13 09:43:46";"2015-10-15 18:07:51";"12";"0";"1";"1";"Kannabia";"";"kannabia";"Kannabia Semillas De Marihuana";"semillas de marihuana,semillas de marihuana baratas,semillas de marihuana de calidad,semillas de marihuana Kannabia,semillas Kannabia";"";
"67";"13";"1";"3";"30";"31";"1";"2015-10-13 09:55:28";"2015-10-13 09:55:28";"13";"0";"1";"1";"Eva Seeds";"";"eva-seeds";"Eva Seeds Semillas De Marihuana";"semillas de marihuana,semillas de marihuana baratas,semillas de calidad,semillas Eva Seeds,Eva Seeds";"";
"68";"13";"1";"3";"32";"33";"1";"2015-10-13 09:56:18";"2015-10-15 17:44:18";"14";"0";"1";"1";"Medical Seeds";"";"medical-seeds";"Medical Seeds Semillas De Marihuana";"semillas de marihuana,semillas de marihuana baratas,semillas de marihuana de calidad,semillas Medical Seeds,Medical Seeds";"";
"69";"13";"1";"3";"34";"35";"1";"2015-10-13 09:56:55";"2015-10-15 18:12:45";"15";"0";"1";"1";"Pyramid Seeds";"";"pyramid-seeds";"Pyramid Seeds Semillas De Marihuana";"semillas de marihuana,semillas de marihuana baratas,semillas de marihuana de calidad,semillas Pyramid Seeds,Pyramid Seeds";"";
"70";"13";"1";"3";"36";"37";"1";"2015-10-13 09:57:26";"2015-10-13 09:57:26";"16";"0";"1";"1";"Mr Nice";"";"mr-nice";"Mr Nice Semillas De Marihuana";"semillas de marihuana,semillas de marihuana baratas,semillas de marihuana de calidad,semillas Mr Nice,Mr Nice";"";
"71";"13";"1";"3";"38";"39";"1";"2015-10-13 09:58:00";"2015-10-13 09:58:00";"17";"0";"1";"1";"Serious Seeds";"";"serious-seeds";"Serious Seeds Semillas De Marihuana";"semillas de marihuana,semillas de marihuana baratas,semillas de marihuana de calidad,semillas Serious Seeds,Serious Seeds";"";
"72";"13";"1";"3";"40";"41";"1";"2015-10-13 09:58:27";"2015-10-13 09:58:27";"18";"0";"1";"1";"Ripper Seeds";"";"ripper-seeds";"Ripper Seeds Semillas De Marihuana";"semillas de marihuana,semillas de marihuana baratas,semillas de marihuana de calidad,semillas Ripper Seeds,Ripper Seeds";"";
"73";"13";"1";"3";"42";"43";"1";"2015-10-13 09:59:13";"2015-10-13 09:59:13";"19";"0";"1";"1";"DNA Genetics";"";"dna-genetics";"DNA Genetics Semillas De Marihuana";"semillas de marihuana,semillas de marihuana baratas,semillas de marihuana de calidad,semillas DNA Genetics,DNA Genetics";"";
"75";"13";"1";"3";"44";"45";"1";"2015-10-13 09:59:38";"2015-10-15 18:16:24";"20";"0";"1";"1";"Royal Queen Seeds";"";"royal-queen-seeds";"Royal Queen Seeds Semillas De Marihuana";"semillas de marihuana,semillas de marihuana baratas,semillas de marihuana de calidad,semillas Royal Queen Seeds,Royal Queen Seeds";"";
"76";"13";"1";"3";"46";"47";"1";"2015-10-13 10:00:02";"2015-10-13 10:00:02";"21";"0";"1";"1";"Mandala Seeds";"";"mandala-seeds";"Mandala Seeds Semillas De Marihuana";"semillas de marihuana,semillas de marihuana baratas,semillas de marihuana de calidad,semillas Mandala Seeds,Mandala Seeds";"";
"77";"13";"1";"3";"48";"49";"1";"2015-10-13 10:00:26";"2015-10-13 10:00:26";"22";"0";"1";"1";"Delicious Seeds";"";"delicious-seeds";"Delicious Seeds Semillas De Marihuana";"semillas de marihuana,semillas de marihuana baratas,semillas de marihuana de calidad,semillas Delicious Seeds,Delicious Seeds";"";
"78";"13";"1";"3";"50";"51";"1";"2015-10-13 10:00:57";"2015-10-15 18:20:09";"23";"0";"1";"1";"Samsara Seeds";"";"samsara-seeds";"Samsara Seeds Semillas de Marihuana";"semillas de marihuana,semillas de marihuana baratas,semillas de marihuana de calidad,semillas Samsara Seeds,Samsara Seeds";"";
"79";"13";"1";"3";"52";"53";"1";"2015-10-13 10:02:16";"2015-10-13 10:02:16";"24";"0";"1";"1";"World of Seeds";"";"world-of-seeds";"World of Seeds Semillas De Marihuana";"semillas de marihuana,semillas de marihuana baratas,semillas de marihuana de calidad,semillas World of Seeds,World of Seeds";"";
"80";"13";"1";"3";"54";"55";"1";"2015-10-13 10:02:38";"2015-10-13 10:02:38";"25";"0";"1";"1";"Big Buddha Seeds";"";"big-buddha-seeds";"Big Buddha Seeds Semillas De Marihuana";"semillas de marihuana,semillas de marihuana de calidad,semillas de marihuana baratas,semillas Big Buddha Seeds,Big Buddha Seeds";"";
"81";"13";"1";"3";"56";"57";"1";"2015-10-13 10:03:01";"2015-10-13 10:03:01";"26";"0";"1";"1";"Ace Seeds";"";"ace-seeds";"Ace Seeds Semillas De Marihuana";"semillas de marihuana,semillas de marihuana baratas,semillas de marihuana de calidad,semillas Ace Seeds,Ace Seeds";"";
"82";"13";"1";"3";"58";"59";"1";"2015-10-13 10:03:41";"2015-10-13 10:03:41";"27";"0";"1";"1";"Sagarmatha";"";"sagarmatha";"Sagarmatha Semillas De Marihuana";"semillas de marihuana,semillas de marihuana baratas,semillas de marihuana de calidad,semillas Sagarmatha,Sagarmatha";"";
"83";"13";"1";"3";"60";"65";"1";"2015-10-13 10:04:06";"2015-10-13 10:04:06";"28";"0";"1";"1";"CBD Seeds";"";"cbd-seeds";"CBD Seeds Semillas De Marihuana";"semillas de marihuana,semillas de marihuana baratas,semillas de marihuana de calidad,semillas CBD Seeds,CBD Seeds";"";
"84";"13";"1";"3";"66";"67";"1";"2015-10-13 10:05:07";"2015-10-13 10:05:07";"29";"0";"1";"1";"Seedmakers";"";"seedmakers";"Seedmakers Semillas De Marihuana";"semillas de marihuana,semillas de marihuana baratas,semillas de marihuana de calidad,semillas Seedmakers,Seedmakers";"";
"85";"13";"1";"3";"68";"69";"1";"2015-10-13 10:05:42";"2015-10-15 18:18:07";"30";"0";"1";"1";"White Label";"";"white-label";"White Label Semillas De Marihuana";"semillas de marihuana,semillas de marihuana baratas,semillas de marihuana de calidad,semillas White Label,White Label";"";
"87";"13";"1";"3";"70";"71";"1";"2015-10-13 10:06:31";"2015-10-13 10:06:31";"31";"0";"1";"1";"The Moon Seeds";"";"the-moon-seeds";"The Moon Seeds Semillas De Marihuana";"semillas de marihuana,semillas de marihuana baratas,semillas de marihuana de calidad,semillas The Moon Seeds,The Moon Seeds";"";